rec_date,theme,source_type,direction,thesis,valid_until
20260702,国产算力·IDC涨价,research,long,"催化:字节投建1GW算力中心;产业调研头部IDC租赁价回升至2020最高、大厂需求旺盛加价明显,涨价集中在有现成机房、带液冷的高密智算中心,有机构称IDC五年首次涨价;行云科技公告控股子公司海南行云与VC客户签5年算力服务协议含税55.08亿;带动行云/润建/润泽等;方向有实锤但注意高开追涨风险",
20260702,机器人·擎天柱产能上调,research,watch,"催化:马斯克视察弗里蒙特Optimus试产线,首条产线自中西部/德国运抵、模块化2-3天装机一周运转;野村称Gen3弗里蒙特年化产能5万上调至约7万台、2028奥斯汀再+7万、长期150万台,2026出货约2.5万(±1万);优必选发布超仿生人形机器人B端转C端;概念五洲新春/三花智控等持续追踪、注意技术走势",
20260702,中报预增·业绩验证,research,long,"7月进入半年报预告窗口,市场核心从估值扩张切向业绩验证;益生/永太/韶能/圆通预增涨停带动养殖/锂电/电力/快递,昨晚雷赛智能/金力永磁/孚日发预增;观察反馈传导,防'见光死'与踩雷",
20260702,海外映射·半导体存储承压,research,watch,"隔夜美股三大指数收跌,费半-6%、存储概念-9%、美光/闪迪-10%;科技股分化Meta+8%(拟构建云业务出售过剩AI算力→市场担心出租算力=不搞模型=算力过剩=capex下修)、微软+3%;叠加日韩早盘下跌,对A股半导体/存储/算力硬件开盘形成情绪压制——观察池半导体标的今日买点位或下移、不宜追,以盯盘破位/回踩确认为准",
20260702,美联储·沃什偏鸽,research,long,"沃什在ECB圆桌与各行长讨论,极力避免透露个人倾向且几乎每问必强调'非前瞻指引',但对AI乐观(先验:AI提升生产率压低通胀)+对近期通胀数据乐观,基调偏鸽,似欲复刻格林斯潘1996因预判生产率加速拒绝加息;未必能说服FOMC、预计服从集体决策,若后续数据支撑则货币政策或系统性转鸽;中期利好、短期无直接催化",
