rec_date,theme,source_type,direction,thesis,valid_until
20260701,被动元件涨价,research,long,"国巨全系列电容涨价(近年最大波):MLCC/铝电解/钽/高分子铝/薄膜/超级电容;AI服务器+HPC+电动车带动高阶被动元件量价齐升;A股受益关注法拉电子600563(薄膜)/江海股份002484(铝电解+超容)/三环300408·风华000636(MLCC),投顾未直接reco A股故仅记主题",
20260701,钨·PCB钻针国产替代,research,long,"三菱7.1执行钨制品涨价50-85%,中国26年2月停止对日钨粉出口,日企库存快耗尽;钻针棒材多次涨价10-20%,头部7月开启涨价;国产替代关注中钨高新000657",
20260701,半导体测试设备·HBM4,research,long,"海力士订购HBM4测试仪(约200台/最高4000亿韩元),AI存储扩产;赛腾688343/长川300604受益,与半导体设备国产替代主线共振",
20260701,7月景气确认,research,long,"定价逻辑从景气预期转向景气确认;中报行情主导结构性,业绩确定性优先;科技内部轮动=低位补涨/相对高位趋势延续/高位扩散;强化Alpha(业绩线)=A级框架,题材线=B/C",
20260701,中欧稀土供应链,research,watch,"中欧磋商阶段性推进,欧盟盼10月前实质成果,稀土等关键物资供应链稳定为谈判重点;利好稀土/关键材料确定性,背景观察",
